"164109352","PRTIMES_JP","1452155398000","それは、タイトルをつけたくなるような親子の一日。父によって撮影された屋根の下のドキュメンタリー。WEB動画公開！ポラス（POLUS)の注文住宅、キャンペーン開催 https://t.co/MEEj5iqnvf @PRTIMES_JP https://t.co/GRv67u0iIm","1"
"164109352","PRTIMES_JP","1452155210000","ペット情報のwebメディア「sippo」、月間150万PV突破 https://t.co/LBsAzYaEVM @PRTIMES_JPさんから https://t.co/PJgtSegvZM","1"
"164109352","PRTIMES_JP","1452155058000","世界中で大人気の「コロリアージュ（大人のぬりえ）」を無料で体験！　著者によるレクチャーも https://t.co/Wzd7hBjxL3 @PRTIMES_JPさんから https://t.co/qwt3i8GPbY","1"
"164109352","PRTIMES_JP","1452145261000","Craft Label Hello!ヴァイツェン”発売のお知らせ https://t.co/NhbJJHS8c5 @PRTIMES_JPさんから https://t.co/eG0oRxZsQG","1"
"164109352","PRTIMES_JP","1452145157000","【ルサンパーム】”ブリトー”の底には”隠れたくあん”！“おにぎらず”と“ブリトー”をあわせた新感覚ワンハンドフードが新登場 https://t.co/drX4YEOzFF @PRTIMES_JPさんから https://t.co/uQGxBiNZto","1"
"164109352","PRTIMES_JP","1452145109000","一夜限りの光と音のナイトシューティングイベント！遊園地をエレクトリックに染めて撃ち合え！！「ELECTRIC GUN（エレクトリックガン） in 真夜中の東京ジョイポリス」 ... https://t.co/Gec6Ugtgp4 https://t.co/1CWE2ybBKx","1"
"164109352","PRTIMES_JP","1452145049000","【KIHACHI】パリの想い出が詰まった、苺たっぷり、サクッサクッの苺スイーツ、数量限定で発売 https://t.co/tYWKSW4EuQ @PRTIMES_JPさんから https://t.co/YJZD0DITbh","1"
"164109352","PRTIMES_JP","1452127449000","「世界でたったひとつ!　コリラックマ　寝袋」や 「リラックマ　ふかふかがまぐち豆本バージョン」が当たる!　WEB限定キャンペーン実施中（?2016年2月29日まで）https://t.co/XsdPOpOdgw https://t.co/XLKeirsPW9","1"
"164109352","PRTIMES_JP","1452127255000","オンラインご近所コミュニティ「PIAZZA」湾岸エリアでスタートhttps://t.co/e5dQ4wncr3 https://t.co/UOs1NKRJmV","1"
"164109352","PRTIMES_JP","1452126636000","図書館をイメージしたカラフルなホームインテリア雑貨専門店 『CORAZYs(カラジー)』2016年1月29日（金）に表参道にてオープン！！https://t.co/uOnpPgtT7I https://t.co/G5NAs4DiHs","1"
"164109352","PRTIMES_JP","1452067717000","事務的でお堅いハンコのイメージをくつがえす！？猫をこよなく愛するハンコ屋店主が作った、かわいいネコのイラスト入りはんこ「ねこずかん」。 https://t.co/lGclvJmwnW @PRTIMES_JPさんから https://t.co/cntF5wybys","1"
"164109352","PRTIMES_JP","1452067467000","「ダイソー」と「フリュー」のコラボレーション商品66点を1月16日（土）より販売開始 https://t.co/38BGqlWWvz @PRTIMES_JPさんから https://t.co/WNJAanPBor","1"
"164109352","PRTIMES_JP","1452067297000","あの感動をスクリーンでもう一度！メ?テレ制作ドラマ「名古屋行き最終列車」を劇場上映 https://t.co/VnpxejxIJx @PRTIMES_JPさんから https://t.co/EjSCKpTjiv","1"
"164109352","PRTIMES_JP","1452055627000","ニコンイメージングジャパン、デジタル一眼レフカメラ「D5」名入れサービスを期間限定で実施 https://t.co/Ell3PFX84a https://t.co/5puNX2PfAX","1"
"164109352","PRTIMES_JP","1452055281000","スマホゲームのプレイヤー向けSNSアプリ「仲間をさがそう HIROBA」のユーザー数が50万人を突破！ https://t.co/piS2SDwtiO https://t.co/lo61LhFcHs","1"
"164109352","PRTIMES_JP","1452054680000","富士山ビュー特急、2016年春デビュー https://t.co/aHhltNwJCz https://t.co/scvnXTfadO","1"
"164109352","PRTIMES_JP","1452053824000","CES 2016にて発表！世界初、ウェアラブル翻訳デバイス 「ili」（イリー）誕生！世界のコミュニケーションを変える。 https://t.co/GMi35N6deq https://t.co/87D14Eb4VT","1"
"164109352","PRTIMES_JP","1452044118000","無印良品2016年　バレンタイン手づくりキットキャンペーンのお知らせ https://t.co/gSN1VLhEcO @PRTIMES_JPさんから https://t.co/fy6A20yOTE","1"
"164109352","PRTIMES_JP","1452044006000","カスタマイズチョコレートオーダーサービスの99chocolateが1月7日から2週間限定で新宿ルミネ2にてPOPUPショップを開催 https://t.co/7JrP3CX5ap @PRTIMES_JPさんから https://t.co/IvlwWfFzju","1"
"164109352","PRTIMES_JP","1452043886000","いとうせいこうが名将や偉人の足跡を経済目線で再考！新番組「せいこうの歴史再考」 https://t.co/kQo05Mrjt9 @PRTIMES_JPさんから https://t.co/pyvdnG2As8","1"
