"3271173853","monjo_fight11","1452155106000","流行中のホワイトカラーコーデ?品よく見えるし、ファーをプラスすれば寒々しくみえない♪ https://t.co/0ewLxDWAEE","1"
"3271173853","monjo_fight11","1452152095000","防水 スポーツ腕時計 https://t.co/bCIjnOVjGS https://t.co/PJiG2c1iwP","1"
"3271173853","monjo_fight11","1452150910000","赤い細ベルトをON♪秋のモテ服コーデ? https://t.co/6SL9BV3edX","1"
"3271173853","monjo_fight11","1452148506000","モノトーンコーデの差し色に、靴下の赤で甘さを抑えた大人ガーリーなコーデ?黒が多めの着こなしでも重く感じません♪ https://t.co/b9Njv9p2nj","1"
"3271173853","monjo_fight11","1452144011000","落ち着きのある雰囲気を作り出す万能色のグレーは人によっては顔色を悪く見せてしまうのでビジューネックレスやカラフルなストールをつけると◎ https://t.co/ysgc1uMwXO","1"
"3271173853","monjo_fight11","1452141606000","縦ストライプのパンツで脚を細く長く見せよう♪ https://t.co/aErK2WmO3x","1"
"3271173853","monjo_fight11","1452137695000","カジュアル　ギアクロック腕時計　EFFORT https://t.co/SZ9dze1pXb https://t.co/UegT7zyEN8","1"
"3271173853","monjo_fight11","1452137107000","子どもっぽくなるショーパンはダークグレーのニーハイと大人なハットで抑えられる♪ https://t.co/D6c53BNpPl","1"
"3271173853","monjo_fight11","1452133511000","ニットワンピ×ロングブーツは毎年はずせないデートコーデ? https://t.co/vvWUlHiqOJ","1"
"3271173853","monjo_fight11","1452132070000","あ","1"
"3271173853","monjo_fight11","1452128706000","レースが透けて春らしいパンプス? 大人かわいいコーデにプラス♪ https://t.co/9E0Nq1VhEr","1"
"3271173853","monjo_fight11","1452126609000","2色コーデ♪白黒が一番失敗なし◎ https://t.co/qg7L1wtnf8","1"
"3271173853","monjo_fight11","1452123905000","子どもっぽくなる三つ編みもミモレ丈スカートと合わせれば大人な雰囲気? https://t.co/2q91rvNFCy","1"
"3271173853","monjo_fight11","1452123294000","スポーツカジュアル　クオーツ時計 | monomo https://t.co/TlRjN8WufM https://t.co/r2SL6gPDP6","1"
"3271173853","monjo_fight11","1452118511000","同色コーデ♪トップスを薄い色、ボトムスを濃い色で合わせるのが今年の流行り? https://t.co/k1FV8YDxNc","1"
"3271173853","monjo_fight11","1452115506000","マニッシュなコーデはベレー帽に前髪を入れてすっきりと♪ https://t.co/XELMyl7mQA","1"
"3271173853","monjo_fight11","1452112206000","ボリューミーなタートルネックでゴージャス感を演出♪小顔効果もあり◎ https://t.co/sh1o2ikVfC","1"
"3271173853","monjo_fight11","1452108992000","ミリタリーウォッチ　スポーツ | monomo https://t.co/EXH61mXrD7 https://t.co/aWjuMvdahY","1"
"3271173853","monjo_fight11","1452107710000","ふりふりワンピースは華奢ネックレスで品よく見せれる！♪ https://t.co/4JG3o57Oph","1"
"3271173853","monjo_fight11","1452104109000","カジュアルさの中にエレガントな雰囲気をプラス? https://t.co/XZqbH4tMRg","1"
